[
  {
    "id": "rct_20260730-0001",
    "toBeModelId": "tbm_pr-review-docs-impl",
    "status": "planning",
    "trigger": {
      "detectedAt": "2026-07-30T04:17:33Z",
      "changedSides": [
        "as_is",
        "to_be"
      ],
      "asIs": {
        "previousVersion": null,
        "currentVersion": "backend:ebf8681c70273edb3950c10225a563d958bfe600 frontend:d1e9dcb2d2ed89a6dd4e4cdf0a8cb21f79522496 packages:ac15382ca41df10ee715a5ac581f56a74295b9bc"
      },
      "toBe": {
        "previousVersion": null,
        "currentVersion": "a3fffbbab4ff37e4c91e1edbdbb89d69b58e1c5d"
      }
    },
    "createdAt": "2026-07-30T04:17:33Z",
    "stateSummary": {
      "asIs": "## 구현 현황 (as-is, 최초 baseline; backend:ebf8681 frontend:d1e9dcb packages:ac15382)\n풀스택 골격만 존재(HEAD `91a86a3` \"bootstrap full-stack skeleton for Lens (no feature logic)\").\n- **backend/**: 7개 PRD 모듈 전부 인터페이스 + 모든 메서드가 `notImplemented('ACx-y')` throw. 컴포지션 루트는 no-op, DB는 SQLite 열기만 하고 스키마 없음(TODO migrations). 어댑터(github/linear/slack)는 read-only 인터페이스 스텁, mutating 메서드 없음.\n- **테스트**: 34개 `it.todo` 스텁이 33개 AC 전부를 커버 → **전부 미구현**.\n- **packages/shared**: 실제 도메인 **타입** 정의만(~393줄), 동작 0.\n- **frontend/**: 4개 라우트 존재하나 13줄 placeholder(\"마크업 포팅 이연\"), C-* 컴포넌트도 placeholder. `frontend/src/styles/tokens.css`(493줄) 정식 토큰 소스로 존재, `docs/design-system/README.md`와 일치.\n- **AC6-5 머지/코드베이스 변경 금지 경계 = 성립**: `backend/src/gap-detection/index.ts`가 `CODEBASE_MUTATION_PERMITTED=false`, frozen `ALLOWED_REVIEW_ACTIONS`, `assertReviewOnly`로 불변식 고정. `gap-detection.test.ts`에 live 회귀 assertion 3개. 레포 전역 merge/push/approve 호출부 grep 결과 없음.",
      "toBe": "## 문서 목표 상태 (to-be, docs@a3fffbb, 최초 baseline)\n- 가치 V1~V5(`docs/values.md`), PRD 7개(metadata/context/perspectives/knowledge-base/logic-engine/gap-detection/presentation).\n- **AC 33개** (AC1-1..1-4=4, AC2-1..2-6=6, AC3-1..3-4=4, AC4-1..4-5=5, AC5-1..5-5=5, AC6-1..6-5=5, AC7-1..7-4=4). AC6-5 = 코드베이스 변경 금지 경계.\n- 테스트 문서 7종(PRD와 1:1), 목업 4화면(review-detail/calibration/gap-fill/knowledge-augment), 여정 J1~J4(18단계), design-system.\n- doc-tracker.md: 33/33 AC 가치연결·테스트커버 주장, 토큰 정식 소스 `frontend/src/styles/tokens.css`로 이전. 최신 로그가 \"풀스택 골격 부트스트랩 … 33 AC it.todo … 기능 코드 0\" 명시.",
      "gap": "최초 baseline gap: 확정 33개 AC 전부가 미구현(모두 `it.todo` 스텁, backend 메서드는 전부 `notImplemented` throw)이고 기능 코드 0 — to-be(docs=33 AC 실현·검증) 대비 as-is(골격만)의 최대 기능 gap이며 정의상 drift다. 단 impl↔doc 불일치·문서 없는 구현은 발견되지 않았고, 두 정체성 불변식(AC6-5 머지금지 경계, tokens.css 정식소스 일치)은 이미 충족 상태다. 등록 시점 기대(골격, 33 AC it.todo, 기능 코드 0)와 정확히 일치.",
      "summarizedAt": "2026-07-30T04:22:40Z"
    },
    "assessment": {
      "actionRequired": true,
      "reason": "최초 관측으로 baseline을 확정: 확정 PRD 7개의 33개 AC 전부 미구현(it.todo), 기능 코드 0 — 정의상 최대 규모의 drift이며 미구현 AC는 backlog가 아니라 drift다. 이 최초 task의 역할은 gap 산정과 planner 인수인계이며, planner가 어느 PRD/AC부터 구현할지 우선순위를 정한다. 진행 중 반드시 보존해야 할 회귀 검증 불변식 2개(AC6-5 머지금지 경계, tokens.css 정식 토큰 소스 일치)는 현재 충족 상태로, feature 작업 중에도 유지되어야 한다. → 작업 필요.",
      "assessedBy": "agent",
      "assessedAt": "2026-07-30T04:22:40Z"
    },
    "updatedAt": "2026-07-30T04:22:40Z"
  }
]
